knowledge,issue_category,reference_url,knowledge_type
疑問文の終わりには疑問符（?）を使用すること,['形式'],19900017394-ページ-109.pdf (Page 1),PDF文書
"引用文や直接話法、区別が必要な語句は引用符（'' または "" ""）で囲むこと",['形式'],19900017394-ページ-109.pdf (Page 1),PDF文書
セミコロン（;）は、カンマでは区切れない並列節や長い列挙、説明的な句や省略節の区切りに使用すること,['形式'],19900017394-ページ-109.pdf (Page 1),PDF文書
スラッシュ（/）は、and/orの表記、分数（x/y）、単位のper（m/sec）、詩の引用に正しく使用すること,['形式'],19900017394-ページ-109.pdf (Page 1),PDF文書
図のキャプションやリストの項目などの要素の最初の文字は大文字で始めること（文頭スタイルの大文字化）,['形式'],19900017394-ページ-109.pdf (Page 1),PDF文書
固有名詞および固有形容詞は固有の意味で使用される場合に大文字で始めること,['文法'],19900017394-ページ-96.pdf (Page 1),PDF文書
独立した意味を持つ固有名詞の派生語は小文字で始めること,['文法'],19900017394-ページ-96.pdf (Page 1),PDF文書
固有形容詞と一般形容詞の区別は辞書を参考にしつつ、分野の慣習と著者の好みを優先すること,['文法'],19900017394-ページ-96.pdf (Page 1),PDF文書
固有名詞の中の普通名詞は固有名詞の一部として使われる場合に大文字で始めること、単独使用時は小文字とすること,['文法'],19900017394-ページ-96.pdf (Page 1),PDF文書
固有名詞の短縮形として一般的に認知されている普通名詞は大文字で始めること,['文法'],19900017394-ページ-96.pdf (Page 1),PDF文書
固有名詞の複数形は大文字で始めること,['文法'],19900017394-ページ-96.pdf (Page 1),PDF文書
ダッシュは文中の要素を区切るために使用すること,['形式'],19900017394-ページ-107.pdf (Page 1),PDF文書
エン・ダッシュは範囲や複合語の修飾語をつなぐために使用すること,['形式'],19900017394-ページ-107.pdf (Page 1),PDF文書
ハイフンは行末の単語の分割や接頭辞・接尾辞の結合、複合語の形成に使用すること,['形式'],19900017394-ページ-107.pdf (Page 1),PDF文書
全文字大文字（フルキャップス）は強調や特定の表現に用いること,['形式'],19900017394-ページ-107.pdf (Page 1),PDF文書
見出しスタイルの大文字化は主要な単語を大文字にすること（headline style capitalization）,['形式'],19900017394-ページ-107.pdf (Page 1),PDF文書
図のキャプションは文の完結に関わらずピリオドで終えること,['形式'],19900017394-ページ-81.pdf (Page 1),PDF文書
"単位の略語にはピリオドを付けないこと（例：ft, cm, NASA）",['形式'],19900017394-ページ-81.pdf (Page 1),PDF文書
単位の略語のうちインチ（in.）のみピリオドを付けること,['形式'],19900017394-ページ-81.pdf (Page 1),PDF文書
"単語の略語には混同を避けるためピリオドを付けること（例：fig., Co., no., Mr.）",['形式'],19900017394-ページ-81.pdf (Page 1),PDF文書
"小数点の前にピリオドを付けること（例：0.2, .68, 29.32）",['形式'],19900017394-ページ-81.pdf (Page 1),PDF文書
金額表記ではドルとセントの間にピリオドを用いること（例：$6.50）,['形式'],19900017394-ページ-81.pdf (Page 1),PDF文書
列挙番号の後にはピリオドを付けること（例：1. Optical rectification）,['形式'],19900017394-ページ-81.pdf (Page 1),PDF文書
研究中のモデルや試料の挙動は過去形で記述すること,['文法'],19900017394-ページ-18.pdf (Page 1),PDF文書
報告書の図表に示す結果は現在形で記述すること,['文法'],19900017394-ページ-18.pdf (Page 1),PDF文書
結果の発生理由の説明は現在形で記述すること,['文法'],19900017394-ページ-18.pdf (Page 1),PDF文書
結論節は通常過去形で記述し、普遍的な結論は現在形で記述すること,['文法'],19900017394-ページ-18.pdf (Page 1),PDF文書
要約は通常現在形で記述すること,['文法'],19900017394-ページ-18.pdf (Page 1),PDF文書
主動詞が現在形または未来形の場合、従属動詞は任意の時制を用いることができること,['文法'],19900017394-ページ-18.pdf (Page 1),PDF文書
主動詞が過去形の場合、従属動詞は過去形を用いること。ただし、従属節が普遍的真理または継続中の動作を表す場合は例外とすること,['文法'],19900017394-ページ-18.pdf (Page 1),PDF文書
文の先頭は大文字で始めること,['文法'],19900017394-ページ-9.pdf (Page 1),PDF文書
引用文の最初の単語は大文字で始めること,['文法'],19900017394-ページ-9.pdf (Page 1),PDF文書
疑問文の最初の単語は大文字で始めること,['文法'],19900017394-ページ-9.pdf (Page 1),PDF文書
箇条書きの各項目は文のスタイルに従い適切に大文字を使用すること,"['文法', '形式']",19900017394-ページ-9.pdf (Page 1),PDF文書
見出しはヘッドラインスタイルの大文字ルールに従うこと（主要単語を大文字にする）,"['文法', '形式']",19900017394-ページ-9.pdf (Page 1),PDF文書
頭字語（アクロニム）はすべて大文字で表記すること,['形式'],19900017394-ページ-9.pdf (Page 1),PDF文書
略語の大文字使用は一般的な慣例に従うこと,['形式'],19900017394-ページ-9.pdf (Page 1),PDF文書
固有名詞および形容詞は適切に大文字で始めること,"['文法', '形式']",19900017394-ページ-9.pdf (Page 1),PDF文書
人名および肩書きは大文字で始めること,"['文法', '形式']",19900017394-ページ-9.pdf (Page 1),PDF文書
地名は正確に大文字で表記すること,"['文法', '形式']",19900017394-ページ-9.pdf (Page 1),PDF文書
技術文書における文法、句読点、及び大文字使用の統一ルールの遵守,"['文法', '形式']",19900017394-ページ-1.pdf (Page 1),PDF文書
文書内の専門用語や技術用語の正確な文法的使用の徹底,"['文法', '単語']",19900017394-ページ-1.pdf (Page 1),PDF文書
句読点の適切な使用による文章の明瞭化と読みやすさの向上,"['文法', '形式']",19900017394-ページ-1.pdf (Page 1),PDF文書
タイトルや見出しにおける大文字使用の一貫性確保（例：米国式大文字ルールの適用）,['形式'],19900017394-ページ-1.pdf (Page 1),PDF文書
所有格の代名詞にアポストロフィは使用しないこと,['文法'],19900017394-ページ-12.pdf (Page 1),PDF文書
代名詞は先行詞と数・性・人称が一致すること,['文法'],19900017394-ページ-12.pdf (Page 1),PDF文書
代名詞の先行詞は明確に示すこと,['文法'],19900017394-ページ-12.pdf (Page 1),PDF文書
代名詞の先行詞が不明瞭な場合は、文を修正して明確にすること,['文法'],19900017394-ページ-12.pdf (Page 1),PDF文書
代名詞の先行詞が遠すぎる場合は、代名詞と先行詞の数が一致しない恐れがあるため修正すること,['文法'],19900017394-ページ-12.pdf (Page 1),PDF文書
無生物名詞に対して所有格の'sを使うことは慣用的に許容される場合があるが、すべての無生物名詞に適用しないこと,['文法'],19900017394-ページ-12.pdf (Page 1),PDF文書
接頭辞と固有名詞または形容詞を結合する際にハイフンを使用すること,['形式'],19900017394-ページ-74.pdf (Page 1),PDF文書
意味が誤解されやすい同形異義語にはハイフンを用いて区別すること,['形式'],19900017394-ページ-74.pdf (Page 1),PDF文書
読み間違いや読みにくさを避けるためにハイフンを使用すること,['形式'],19900017394-ページ-74.pdf (Page 1),PDF文書
母音が重複したり子音が三重になる場合はハイフンを用いること,['形式'],19900017394-ページ-74.pdf (Page 1),PDF文書
接頭辞co、de、pre、pro、reは母音が重複してもハイフンを使わず連結して表記すること,['形式'],19900017394-ページ-74.pdf (Page 1),PDF文書
接頭辞をハイフンで区切られた複合語に付ける場合はハイフンを使用すること,['形式'],19900017394-ページ-74.pdf (Page 1),PDF文書
接尾辞を単語に接続する際は原則としてハイフンを使わないこと,['形式'],19900017394-ページ-74.pdf (Page 1),PDF文書
子音が三重になるのを避けるために接尾辞を接続する際はハイフンを使用すること,['形式'],19900017394-ページ-74.pdf (Page 1),PDF文書
接尾辞likeを固有名詞に付ける場合はハイフンを使用すること,['形式'],19900017394-ページ-74.pdf (Page 1),PDF文書
複合語は辞書に掲載されている場合は固有の形（連結またはハイフン付き）を用い、一般的には一時的な複合語のハイフン使用は避けること,['形式'],19900017394-ページ-74.pdf (Page 1),PDF文書
数字や文字とともに用いられる普通名詞は大文字にしないこと,['形式'],19900017394-ページ-97.pdf (Page 1),PDF文書
公式名称の一部である場合のみ定冠詞theを大文字にすること,['形式'],19900017394-ページ-97.pdf (Page 1),PDF文書
"外国人名の前置詞（d', de, du, vonなど）は、名前や肩書きの前にない場合に大文字にすること",['形式'],19900017394-ページ-97.pdf (Page 1),PDF文書
"一般名詞として使われる個人名は大文字にしないこと（例：単位名のcurie, watt, newton, kelvin）",['形式'],19900017394-ページ-97.pdf (Page 1),PDF文書
摂氏、華氏、ランキン度の単位はdegreeとともに大文字で表記すること（degree Celsiusなど）,['形式'],19900017394-ページ-97.pdf (Page 1),PDF文書
個人名の前にある公的・職業的肩書きは大文字にすること（例：President Reagan）,['形式'],19900017394-ページ-97.pdf (Page 1),PDF文書
"個人名の後や同格で用いられる肩書きは大文字にしないこと（例：the chief scientist, Richard Barnwell）",['形式'],19900017394-ページ-97.pdf (Page 1),PDF文書
"個人名の後や代わりに用いられる公的・職業的肩書きは通常大文字にしないこと（例：Richard Petersen, director of Langley Research Center）",['形式'],19900017394-ページ-97.pdf (Page 1),PDF文書
技術文書ではほとんどの動詞を直説法で用いること,['文法'],19900017394-ページ-19.pdf (Page 1),PDF文書
命令、提案、推奨、要求を示す場合は接続法を用いること,['文法'],19900017394-ページ-19.pdf (Page 1),PDF文書
事実に反する条件や極めてありえない状況を示す場合に接続法を用いること,['文法'],19900017394-ページ-19.pdf (Page 1),PDF文書
接続法は著者が強い疑念を示したい場合にのみ使用すること,['文法'],19900017394-ページ-19.pdf (Page 1),PDF文書
動詞の態は主語が動作を行うか受けるかを示すこと,['文法'],19900017394-ページ-19.pdf (Page 1),PDF文書
文章は直接的で明確かつ自然なため、能動態の使用を推奨すること,['文法'],19900017394-ページ-19.pdf (Page 1),PDF文書
受動態は動作者が重要でない、知られていない、または言及すべきでない場合に適切に使用すること,['文法'],19900017394-ページ-19.pdf (Page 1),PDF文書
受動態は動作の受け手を強調したい場合に使用すること,['文法'],19900017394-ページ-19.pdf (Page 1),PDF文書
受動態は能動態で文章が唐突になる場合に使用すること,['文法'],19900017394-ページ-19.pdf (Page 1),PDF文書
受動態は能動態の文章に変化をつけたい場合に使用すること,['文法'],19900017394-ページ-19.pdf (Page 1),PDF文書
技術論文の文法、句読点、及び大文字使用は文脈に応じて適用すること,"['文法', '形式']",19900017394-ページ-4.pdf (Page 1),PDF文書
文法、句読点、大文字使用のルールは変化し、場合によっては破ることが許容されること,"['文法', '形式']",19900017394-ページ-4.pdf (Page 1),PDF文書
論文のスタイルは編集者の好みや伝統に基づくことが多く、一定のスタイルに従うことが推奨されること,['形式'],19900017394-ページ-4.pdf (Page 1),PDF文書
従属節内でthatの繰り返し禁止,['文法'],19900017394-ページ-31.pdf (Page 1),PDF文書
thatの後に挿入句がある場合、thatを繰り返さずに文を構成すること,['文法'],19900017394-ページ-31.pdf (Page 1),PDF文書
動名詞は単数動詞を伴うこと,['文法'],19900017394-ページ-31.pdf (Page 1),PDF文書
連結された動名詞主語が単一の過程を表す場合、単数動詞を用いること,['文法'],19900017394-ページ-31.pdf (Page 1),PDF文書
連結された動名詞や不定詞の前置詞は、過程を表す場合に繰り返さないことが推奨される,"['文法', '形式']",19900017394-ページ-31.pdf (Page 1),PDF文書
動詞の後に続く語が動名詞か不定詞かは慣用表現に依存すること,['文法'],19900017394-ページ-31.pdf (Page 1),PDF文書
文章は能動態で簡潔に表現すること,['文法'],19900017394-ページ-45.pdf (Page 1),PDF文書
曖昧な表現（hedging）は避け、断定的な表現を用いること,['文法'],19900017394-ページ-45.pdf (Page 1),PDF文書
不必要な強調表現（intensifiers）は使用しないこと,['文法'],19900017394-ページ-45.pdf (Page 1),PDF文書
冗長な言い回しや無意味なフレーズは削除し、簡潔に記述すること,['文法'],19900017394-ページ-45.pdf (Page 1),PDF文書
"曖昧な表現の代わりに明確な単語を使用すること（例：a majority of→most, due to the fact that→because）","['単語', '文法']",19900017394-ページ-45.pdf (Page 1),PDF文書
"引用文献の表現は簡潔にし、著者名と参照番号を用いること（例：Reference 1 showed that..., Hathwell (ref. 1) showed that ...）","['文法', '形式']",19900017394-ページ-45.pdf (Page 1),PDF文書
引用内の省略記号（省略点）が文末のピリオドに続く場合、次の文の最初の単語は大文字にできる,['文法'],19900017394-ページ-92.pdf (Page 1),PDF文書
直接疑問文の最初の単語は大文字にしても小文字にしてもよい,['文法'],19900017394-ページ-92.pdf (Page 1),PDF文書
間接疑問文の最初の単語は決して大文字にしない,['文法'],19900017394-ページ-92.pdf (Page 1),PDF文書
箇条書きの項目は、完全な文であってもなくても最初の単語を大文字にすることが推奨される,"['文法', '段落構成']",19900017394-ページ-92.pdf (Page 1),PDF文書
箇条書きが文中にある場合は、項目の最初の単語を大文字にしないこと,"['文法', '段落構成']",19900017394-ページ-92.pdf (Page 1),PDF文書
主語を明確にすること,['文法'],19900017394-ページ-7.pdf (Page 1),PDF文書
動詞を力強くすること,['文法'],19900017394-ページ-7.pdf (Page 1),PDF文書
主語と動詞の関係を改善すること,['文法'],19900017394-ページ-7.pdf (Page 1),PDF文書
並列構造を適切に用いること,['文法'],19900017394-ページ-7.pdf (Page 1),PDF文書
並列を要求する接続詞を正しく使うこと,['文法'],19900017394-ページ-7.pdf (Page 1),PDF文書
箇条書きを適切に用いること,"['文法', '形式']",19900017394-ページ-7.pdf (Page 1),PDF文書
冗長な表現を避けて簡潔に記述すること,"['文法', '形式']",19900017394-ページ-7.pdf (Page 1),PDF文書
文章やタイトルを短くすること,"['文法', '形式']",19900017394-ページ-7.pdf (Page 1),PDF文書
形容詞と副詞の比較表現を正しく使うこと,['文法'],19900017394-ページ-7.pdf (Page 1),PDF文書
曖昧な比較表現を避けること,['文法'],19900017394-ページ-7.pdf (Page 1),PDF文書
タイトルの単語は米国式大文字ルールに従うこと,['形式'],19900017394-ページ-111.pdf (Page 1),PDF文書
句読点の使用は文法的ルールに従い、特にコンマは独立節や修飾語の区切りに正しく配置すること,['文法'],19900017394-ページ-111.pdf (Page 1),PDF文書
コロンは完全な文の後や「以下の通り」などの表現の後に使用すること,['文法'],19900017394-ページ-111.pdf (Page 1),PDF文書
コンマは導入句や修飾節の後に必ず配置すること,['文法'],19900017394-ページ-111.pdf (Page 1),PDF文書
複合語のハイフンは語の意味を明確にするために適切に使用すること,['形式'],19900017394-ページ-111.pdf (Page 1),PDF文書
比較級の形容詞や修飾語は単位修飾語内で正しく使用すること,['文法'],19900017394-ページ-111.pdf (Page 1),PDF文書
非制限的修飾語や非制限的関係節にはコンマを用いて区切ること,['文法'],19900017394-ページ-111.pdf (Page 1),PDF文書
句読点は文章の意味を明確にするために適切に配置し、句読点の誤用（例：コンマスプライス）を避けること,['文法'],19900017394-ページ-111.pdf (Page 1),PDF文書
句読点の使用は文章の強調や意味の区切りに配慮し、クローズスタイルの句読点を適用すること,['文法'],19900017394-ページ-111.pdf (Page 1),PDF文書
固有名詞や国名、天体名などの単語は適切に大文字化すること,['形式'],19900017394-ページ-111.pdf (Page 1),PDF文書
ダッシュはタイトルとサブタイトルの区切りに使用すること,['形式'],19900017394-ページ-72.pdf (Page 1),PDF文書
ダッシュはあいまいまたは未完の期間表記に使用すること（例：1974-）,['形式'],19900017394-ページ-72.pdf (Page 1),PDF文書
セミコロン、コロン、疑問符、ピリオド、感嘆符はダッシュに優先し、ダッシュを置き換えること（カンマは除く）,['形式'],19900017394-ページ-72.pdf (Page 1),PDF文書
"エンダッシュは連続または範囲を示す数字や日付の表記に使用すること（例：pp. 233-235, Oct. 1975-Jan. 1976）",['形式'],19900017394-ページ-72.pdf (Page 1),PDF文書
エンダッシュは「from ... to ...」や「between ... and ...」の表現には使用しないこと,['形式'],19900017394-ページ-72.pdf (Page 1),PDF文書
エンダッシュは単位修飾語と二語またはハイフンでつながれた要素をつなぐために使用すること（例：New York-London flight）,['形式'],19900017394-ページ-72.pdf (Page 1),PDF文書
すべて大文字のテキストではハイフンの代わりにエンダッシュを使用すること,['形式'],19900017394-ページ-72.pdf (Page 1),PDF文書
代名詞の先行詞は明確かつ適切に設定し、代名詞と先行詞の一致を確認すること,['文法'],19900017394-ページ-13.pdf (Page 1),PDF文書
"技術文書における一人称代名詞（I, we）は、著者の意見を表現する場合に使用可能であること",['文法'],19900017394-ページ-13.pdf (Page 1),PDF文書
技術文書での編集的なwe（読者と著者を含む意味）は、数学的説明などで使用されることがあるため、先行詞を明確にすること,['文法'],19900017394-ページ-13.pdf (Page 1),PDF文書
三人称単数代名詞の性別は文法的に男性形が用いられるが、性別が不明または女性の場合は男性形の使用を避け、先行詞を複数形にして中立化することが推奨される,['文法'],19900017394-ページ-13.pdf (Page 1),PDF文書
番号付きリストの導入文が完全な文でない場合、リストの前にコロンを使用しないこと,['段落構成'],19900017394-ページ-59.pdf (Page 1),PDF文書
番号付きリストの導入文が完全な文の場合、リストの前にコロンを使用することが推奨されるが、動詞の後のコロン使用は文法的に疑わしく不要であること,['段落構成'],19900017394-ページ-59.pdf (Page 1),PDF文書
コロンは、2つの節の間で後の節が前の節を補足または言い換える場合に使用すること,['文法'],19900017394-ページ-59.pdf (Page 1),PDF文書
コロンの後の最初の単語は完全な文の始まりであれば大文字にできるが、大文字化は任意であること,['文法'],19900017394-ページ-59.pdf (Page 1),PDF文書
コロンはダッシュやセミコロンよりも形式的で、導入の強調力が強いこと,"['文法', '形式']",19900017394-ページ-59.pdf (Page 1),PDF文書
表示された数式を導入する際にコロンを使用することが特に有効であること,['形式'],19900017394-ページ-59.pdf (Page 1),PDF文書
技術文書における文法、句読点、及び大文字使用の統一ルールの遵守,"['文法', '形式']",19900017394-ページ-2.pdf (Page 1),PDF文書
技術文書の執筆および編集において、明確で一貫した文体を維持すること,"['文法', '形式']",19900017394-ページ-2.pdf (Page 1),PDF文書
アポストロフィは所有を示すために使用すること,['形式'],19900017394-ページ-106.pdf (Page 1),PDF文書
引用文中の編集挿入や訂正、コメントは角括弧で囲むこと,['形式'],19900017394-ページ-106.pdf (Page 1),PDF文書
コロンはリスト、節、引用を区切り導入するために使用すること,['形式'],19900017394-ページ-106.pdf (Page 1),PDF文書
カンマは文の要素を区切り誤読を防ぐために使用すること,['形式'],19900017394-ページ-106.pdf (Page 1),PDF文書
大文字小文字の使い分けは主要語を大文字にすること,['形式'],19900017394-ページ-106.pdf (Page 1),PDF文書
長くて論争のある形容詞の間にコンマを入れることが適切であること,['文法'],19900017394-ページ-64.pdf (Page 1),PDF文書
形容詞が独立して名詞を修飾する場合、形容詞の順序を入れ替えても意味が変わらないことを確認すること,['文法'],19900017394-ページ-64.pdf (Page 1),PDF文書
形容詞が座標的（coordinate）であるかどうかは技術的意味を理解した上で判断すること,['文法'],19900017394-ページ-64.pdf (Page 1),PDF文書
形容詞間のコンマは強調を加える効果があるが、疑わしい場合はコンマを入れないことが現在の傾向であること,['文法'],19900017394-ページ-64.pdf (Page 1),PDF文書
文中の繰り返される要素（例えば動詞）が省略される場合、その省略を示すためにコンマを用いること,['文法'],19900017394-ページ-64.pdf (Page 1),PDF文書
省略された要素が短い場合は、コンマを省略してもよいこと,['文法'],19900017394-ページ-64.pdf (Page 1),PDF文書
直接引用や疑問文は文の他の部分からコンマまたはコロンで区切ること,['文法'],19900017394-ページ-64.pdf (Page 1),PDF文書
長くて正式な引用文を導入する場合はコロンを用いること,['文法'],19900017394-ページ-64.pdf (Page 1),PDF文書
直接引用や疑問文の前にはコンマを置くこと,['文法'],19900017394-ページ-64.pdf (Page 1),PDF文書
疑問文の最初の単語は大文字にしてもしなくてもよいこと,['文法'],19900017394-ページ-64.pdf (Page 1),PDF文書
地名（川、山、湾、都市）の固有名詞は大文字で始めること,['文法'],19900017394-ページ-99.pdf (Page 1),PDF文書
一般名詞としての地理的用語（lake、city、riverなど）は小文字で記載すること,['文法'],19900017394-ページ-99.pdf (Page 1),PDF文書
特定の地理的名称で慣例的に大文字となる例外（例：the Canal、the Channel）は大文字で記載すること,['文法'],19900017394-ページ-99.pdf (Page 1),PDF文書
政治的区分の正式名称は大文字で記載すること（例：Canada、United States、New York State）,['文法'],19900017394-ページ-99.pdf (Page 1),PDF文書
政府機関名や行政部門名は大文字で記載すること（例：U.S. Government、Environmental Protection Agency）,['文法'],19900017394-ページ-99.pdf (Page 1),PDF文書
