knowledge,issue_category,reference_url,knowledge_type
文中の強調位置は文頭と文末であることを意識すること,['段落構成'],19900017394-ページ-53.pdf (Page 1),PDF文書
修飾語句を文頭に移動するとその語句が強調されること,['段落構成'],19900017394-ページ-53.pdf (Page 1),PDF文書
修飾語句を文中の異常な位置に置くことで内部要素を強調できること,['段落構成'],19900017394-ページ-53.pdf (Page 1),PDF文書
修飾語の誤配置に注意し、意味が曖昧にならないようにすること,['文法'],19900017394-ページ-53.pdf (Page 1),PDF文書
"接続副詞（however, therefore, hence, thus）は文中の直前の語を強調するために用いることができること",['文法'],19900017394-ページ-53.pdf (Page 1),PDF文書
修飾語の強調において、制限的でない副詞の前後にコンマを使用して強調を増すこと,['文法'],19900017394-ページ-54.pdf (Page 1),PDF文書
制限的な副詞の前後にはコンマを使用しないこと,['文法'],19900017394-ページ-54.pdf (Page 1),PDF文書
並列形容詞の間にコンマを入れて、それぞれの形容詞を強調すること,['文法'],19900017394-ページ-54.pdf (Page 1),PDF文書
並列形容詞の間のコンマを「and」に置き換えることで、さらに強調を高めること,['文法'],19900017394-ページ-54.pdf (Page 1),PDF文書
コロンを用いてリストを導入することで、リストの内容を強調すること,['文法'],19900017394-ページ-54.pdf (Page 1),PDF文書
ダッシュを用いて、挿入要素、非制限的修飾語、説明的な句や節を強調すること,['文法'],19900017394-ページ-54.pdf (Page 1),PDF文書
イタリック体は語の区別、強調、専門用語、記号の表現に使用すること,['形式'],19900017394-ページ-113.pdf (Page 1),PDF文書
イタリック体は句読点と組み合わせて使用する際のルールを守ること,['形式'],19900017394-ページ-113.pdf (Page 1),PDF文書
引用符は専門用語やジャーゴンの周囲に使用すること,['形式'],19900017394-ページ-113.pdf (Page 1),PDF文書
リストは番号付きリストと通常リストを区別して使用すること,['形式'],19900017394-ページ-113.pdf (Page 1),PDF文書
数字の表記においてカンマの使用法を正しく適用すること,['形式'],19900017394-ページ-113.pdf (Page 1),PDF文書
数字の範囲を示す際はエンダッシュを使用すること,['形式'],19900017394-ページ-113.pdf (Page 1),PDF文書
数字の複数形の扱いに注意すること,['文法'],19900017394-ページ-113.pdf (Page 1),PDF文書
オープンスタイルの句読点を適切に使用すること,['形式'],19900017394-ページ-113.pdf (Page 1),PDF文書
並列構造（パラレリズム）を文中で維持すること,['文法'],19900017394-ページ-113.pdf (Page 1),PDF文書
句読点の使用において、特にカンマとピリオドの位置に注意すること,['形式'],19900017394-ページ-113.pdf (Page 1),PDF文書
異なる(preposition)は from を用いること,['文法'],19900017394-ページ-52.pdf (Page 1),PDF文書
different than は特定の文脈でのみ使用可能であり、通常は避けること,['文法'],19900017394-ページ-52.pdf (Page 1),PDF文書
比較においては、demonstrative pronouns を用いて明確にすること（例: different from that）,['文法'],19900017394-ページ-52.pdf (Page 1),PDF文書
"比較表現には idiomatic correlative construction の the ... , the ... を用いること（例: The lower the temperature, the more brittle the steel becomes）",['文法'],19900017394-ページ-52.pdf (Page 1),PDF文書
文の強調は文構造を用いて行うことが効果的であり、特に parallelism を活用すること,"['文法', '段落構成']",19900017394-ページ-52.pdf (Page 1),PDF文書
parallel constructions では、冠詞、前置詞、導入語の繰り返しにより個々の項目の強調を高めることができる,"['文法', '段落構成']",19900017394-ページ-52.pdf (Page 1),PDF文書
強調したい文は、前の文と明確に異なる構造（短文の後に長文、複雑文の後に単純文など）にすること,"['文法', '段落構成']",19900017394-ページ-52.pdf (Page 1),PDF文書
対比を含む文は重要なアイデアを含むことを確認すること,"['文法', '段落構成']",19900017394-ページ-52.pdf (Page 1),PDF文書
セクション番号にはピリオドを使用すること,['形式'],19900017394-ページ-82.pdf (Page 1),PDF文書
ピリオドは引用符、括弧、角括弧、及び省略記号とともに使用可能であること。ただし略語の後のピリオドは繰り返さないこと,['形式'],19900017394-ページ-82.pdf (Page 1),PDF文書
ピリオドは閉じる引用符の前に置くこと,['形式'],19900017394-ページ-82.pdf (Page 1),PDF文書
ピリオドは通常閉じる括弧の外に置くこと。ただし、完全な括弧内文が他の文に含まれない場合は括弧内にピリオドを置くこと,['形式'],19900017394-ページ-82.pdf (Page 1),PDF文書
省略記号は3つの均等に間隔をあけたピリオドで表記すること,['形式'],19900017394-ページ-82.pdf (Page 1),PDF文書
省略記号は引用文の省略を示すために使用すること,['形式'],19900017394-ページ-82.pdf (Page 1),PDF文書
省略記号はテキスト中の引用文の前後、完全な文で始まるブロック引用の前、完全な文で終わるブロック引用の後には使用しないこと,['形式'],19900017394-ページ-82.pdf (Page 1),PDF文書
省略記号は引用符の内側に置くこと,['形式'],19900017394-ページ-82.pdf (Page 1),PDF文書
見出し、タイトル、キャプションの大文字化は文頭の1文字と固有名詞のみを大文字にする文頭スタイルか、主要語をすべて大文字にする見出しスタイルのいずれかを用いること,['段落構成'],19900017394-ページ-90.pdf (Page 1),PDF文書
固有名詞と形容詞は大文字にすることが明確に認められているが、固有名詞の範囲は編集者間で意見が分かれるため、論文内で一貫性を保つことが重要であること,['文法'],19900017394-ページ-90.pdf (Page 1),PDF文書
文頭、引用文、キャプションの最初の文字は必ず大文字にすること,['文法'],19900017394-ページ-90.pdf (Page 1),PDF文書
論文内の大文字使用は過剰な大文字使用を避け、必要最小限に抑えるダウンスタイルを推奨すること,"['文法', '形式']",19900017394-ページ-90.pdf (Page 1),PDF文書
ページ番号は印刷しないこと,['形式'],19900017394-ページ-55.pdf (Page 1),PDF文書
論文のフォントサイズは10ポイントに設定すること,['形式'],19900017394-ページ-55.pdf (Page 1),PDF文書
タイトルは米国の大文字ルールに従うこと,"['形式', '文法']",19900017394-ページ-55.pdf (Page 1),PDF文書
要約は200語以内に制限すること,['形式'],19900017394-ページ-55.pdf (Page 1),PDF文書
引用は著者名と年を記載すること,"['形式', '文法']",19900017394-ページ-55.pdf (Page 1),PDF文書
図のキャプションは図の下に配置すること,['形式'],19900017394-ページ-55.pdf (Page 1),PDF文書
図の環境でのセンタリングを推奨すること,['形式'],19900017394-ページ-55.pdf (Page 1),PDF文書
タイプ3フォントの使用は禁止すること,['形式'],19900017394-ページ-55.pdf (Page 1),PDF文書
"セミコロンは独立した節を導入するthat is, namely, for exampleなどの説明句の前に置くこと",['文法'],19900017394-ページ-88.pdf (Page 1),PDF文書
省略構文で省略を示すためにコンマが必要な場合、セミコロンで省略節を区切ること,['文法'],19900017394-ページ-88.pdf (Page 1),PDF文書
省略構文でコンマが不要な場合は、接続詞で節をつなぎコンマを用いることが可能であること,['文法'],19900017394-ページ-88.pdf (Page 1),PDF文書
セミコロンは閉じ括弧や引用符の後に置くこと,['形式'],19900017394-ページ-88.pdf (Page 1),PDF文書
引用文の末尾ではセミコロンを省略すること,['形式'],19900017394-ページ-88.pdf (Page 1),PDF文書
文の最初の単語は大文字で始めること,['文法'],19900017394-ページ-91.pdf (Page 1),PDF文書
括弧内にある文が別の文の一部である場合、その文の最初の単語は大文字にしないこと,['文法'],19900017394-ページ-91.pdf (Page 1),PDF文書
括弧内の文が独立した文である場合、その文の最初の単語は大文字で始めること,['文法'],19900017394-ページ-91.pdf (Page 1),PDF文書
断片的な文（フラグメント文）が文書に現れる場合は、最初の単語を大文字にすること,['文法'],19900017394-ページ-91.pdf (Page 1),PDF文書
コロンの後の最初の単語は、完全な文の始まりであれば大文字にしてもよいが、必須ではないこと,['文法'],19900017394-ページ-91.pdf (Page 1),PDF文書
直接引用文が文の一部として独立している場合は、引用文の最初の単語を大文字で始めること,['文法'],19900017394-ページ-91.pdf (Page 1),PDF文書
引用文が文の一部として文法的に依存している場合は、引用文の最初の単語を小文字で始めること,['文法'],19900017394-ページ-91.pdf (Page 1),PDF文書
引用符は非標準的に使用される造語や専門用語の初出時にのみ使用すること,['形式'],19900017394-ページ-86.pdf (Page 1),PDF文書
引用符は報告書や書籍の章タイトル、非斜体の論文・記事タイトルに使用すること,['形式'],19900017394-ページ-86.pdf (Page 1),PDF文書
参考文献リストや文献目録では引用符を使用しないこと,['形式'],19900017394-ページ-86.pdf (Page 1),PDF文書
引用符は句読点の後に置くこと（句読点は引用符の内側）,['形式'],19900017394-ページ-86.pdf (Page 1),PDF文書
引用符はセミコロンやコロンの前に置くこと（引用符は外側）,['形式'],19900017394-ページ-86.pdf (Page 1),PDF文書
引用符は省略記号の後に置くこと（省略記号は引用符の内側）,['形式'],19900017394-ページ-86.pdf (Page 1),PDF文書
引用符の外側にある句読点以外の記号（括弧、疑問符など）は引用内容に含まれない場合は外側に置くこと,['形式'],19900017394-ページ-86.pdf (Page 1),PDF文書
セミコロンは等位の節を結ぶ際に使用すること,['形式'],19900017394-ページ-86.pdf (Page 1),PDF文書
等位接続詞がない場合、等位節はセミコロンで結ぶこと,['形式'],19900017394-ページ-86.pdf (Page 1),PDF文書
タイトルの冠詞は不要な場合は削除すること,['文法'],19900017394-ページ-47.pdf (Page 1),PDF文書
タイトルの前置詞句は単位修飾語に変換して簡潔にすること,"['文法', '段落構成']",19900017394-ページ-47.pdf (Page 1),PDF文書
タイトルの単位修飾語の連続は意味が曖昧になるため注意すること,"['文法', '段落構成']",19900017394-ページ-47.pdf (Page 1),PDF文書
タイトルの前置詞句を減らすために副題を用いて主題を強調すること,['段落構成'],19900017394-ページ-47.pdf (Page 1),PDF文書
タイトルの動詞由来名詞を動名詞に変えて前置詞を減らし表現を活性化すること,"['文法', '単語']",19900017394-ページ-47.pdf (Page 1),PDF文書
タイトルは情報量を最大にしつつ語数は最小限に抑えること,['段落構成'],19900017394-ページ-47.pdf (Page 1),PDF文書
タイトルの語句を短縮しすぎて意味が失われないように注意すること,['段落構成'],19900017394-ページ-47.pdf (Page 1),PDF文書
単位修飾語の最初の要素が比較級または最上級の場合はイタリック体を使用すること,['形式'],19900017394-ページ-76.pdf (Page 1),PDF文書
単位修飾語の最初の要素がlyで終わる副詞の場合はイタリック体を使用すること,['形式'],19900017394-ページ-76.pdf (Page 1),PDF文書
単位修飾語が外国語のフレーズの場合はイタリック体を使用すること,['形式'],19900017394-ページ-76.pdf (Page 1),PDF文書
単位修飾語が固有名詞の場合はイタリック体を使用すること（例外としてAnglo-American planは除く）,['形式'],19900017394-ページ-76.pdf (Page 1),PDF文書
単位修飾語の第二要素が文字または数字の指定の場合はイタリック体を使用すること,['形式'],19900017394-ページ-76.pdf (Page 1),PDF文書
単位修飾語が引用符で囲まれている場合はイタリック体を使用すること,['形式'],19900017394-ページ-76.pdf (Page 1),PDF文書
単位修飾語が科学的名称（化学物質、動植物名）で通常ハイフンを使わない場合はイタリック体を使用すること,['形式'],19900017394-ページ-76.pdf (Page 1),PDF文書
単位修飾語は常にハイフンでつなぐこと,['形式'],19900017394-ページ-76.pdf (Page 1),PDF文書
単位修飾語に過去分詞または現在分詞が含まれる場合はイタリック体を使用すること,['形式'],19900017394-ページ-76.pdf (Page 1),PDF文書
単位修飾語に色の組み合わせが含まれる場合はイタリック体を使用すること,['形式'],19900017394-ページ-76.pdf (Page 1),PDF文書
比較表現におけるas ... as構文では、第二のasを省略しないこと,['文法'],19900017394-ページ-51.pdf (Page 1),PDF文書
比較級修飾語が介在する場合、as ... as構文の第二のasを必ず含めること,['文法'],19900017394-ページ-51.pdf (Page 1),PDF文書
形容詞differentは不要な場合は削除し、意味が明確な場合のみ使用すること,['文法'],19900017394-ページ-51.pdf (Page 1),PDF文書
形容詞differentを使う場合は、より活発な動詞differに置き換えることを推奨すること,['文法'],19900017394-ページ-51.pdf (Page 1),PDF文書
"比較表現では、前置詞の選択に注意し、""increase by""より""increase over""の方が適切な場合があること",['文法'],19900017394-ページ-51.pdf (Page 1),PDF文書
"文中の比較対象を明確に示すために、""increase of X percent over that of Y""のように表現すること",['文法'],19900017394-ページ-51.pdf (Page 1),PDF文書
人名の後に続く共通名詞の肩書きは区別を示す場合に大文字で始めること,['文法'],19900017394-ページ-98.pdf (Page 1),PDF文書
特定の読者向け文書では、個人名の一部または代わりに用いられる共通名詞の肩書きを大文字で表記可能であること,['文法'],19900017394-ページ-98.pdf (Page 1),PDF文書
"地理的特徴の名称は大文字で表記すること（例：Northern Hemisphere, Arctic Circle）",['文法'],19900017394-ページ-98.pdf (Page 1),PDF文書
"地域名や地方名は固有名詞として大文字で表記すること（例：Middle East, Southeast Asia）",['文法'],19900017394-ページ-98.pdf (Page 1),PDF文書
方角は、特定の地域名として確立された場合のみ大文字で表記すること（例：North Atlantic States）,['文法'],19900017394-ページ-98.pdf (Page 1),PDF文書
"一般的な方角や形容詞として用いられる場合は小文字で表記すること（例：equatorial, western Virginia）",['文法'],19900017394-ページ-98.pdf (Page 1),PDF文書
間接引用や文の文法構造の一部である引用にはコンマやコロンを用いないこと,['形式'],19900017394-ページ-65.pdf (Page 1),PDF文書
囲みコンマは必ず対となる句読点（コンマ、コロン、セミコロン、ピリオド、疑問符、感嘆符）とセットで使用すること,['形式'],19900017394-ページ-65.pdf (Page 1),PDF文書
非制限的修飾語は文の意味に影響しないため、必ずコンマで囲むこと,['形式'],19900017394-ページ-65.pdf (Page 1),PDF文書
非制限的前置詞句および動詞句はコンマで囲むこと,['形式'],19900017394-ページ-65.pdf (Page 1),PDF文書
制限的修飾語と非制限的修飾語を区別して適切にコンマを使用すること,['形式'],19900017394-ページ-65.pdf (Page 1),PDF文書
非制限的関係節はコンマで囲むこと,['形式'],19900017394-ページ-65.pdf (Page 1),PDF文書
動詞は主語の数に一致させること,['文法'],19900017394-ページ-20.pdf (Page 1),PDF文書
andで結ばれた主語は複数形の動詞を用いること,['文法'],19900017394-ページ-20.pdf (Page 1),PDF文書
orまたはnorで結ばれた単数の主語は単数形の動詞を用いること,['文法'],19900017394-ページ-20.pdf (Page 1),PDF文書
orまたはnorで結ばれた単数と複数の主語は、動詞の数を近い主語に合わせること,['文法'],19900017394-ページ-20.pdf (Page 1),PDF文書
and/orを用いる場合、動詞の数は文脈により単数または複数のいずれも許容されるが、使用は避けることが推奨されること,['文法'],19900017394-ページ-20.pdf (Page 1),PDF文書
主語と動詞の間に挿入句があっても、動詞の数は主語に一致させること,['文法'],19900017394-ページ-20.pdf (Page 1),PDF文書
"単数か複数か判別が難しい名詞（例：aeronautics, equipment, apparatus, hardware, phenomena, data, criteria）は辞書や用法書で確認すること",['単語'],19900017394-ページ-20.pdf (Page 1),PDF文書
受動態の使用は技術文書で多いが、可能な場合は能動態に書き換えることが推奨されること,['文法'],19900017394-ページ-20.pdf (Page 1),PDF文書
不定冠詞aは子音の発音で始まる単語の前に置くこと,['文法'],19900017394-ページ-22.pdf (Page 1),PDF文書
不定冠詞anは母音の発音で始まる単語の前に置くこと,['文法'],19900017394-ページ-22.pdf (Page 1),PDF文書
略語や頭字語の前の冠詞は発音に基づいて選択すること,['文法'],19900017394-ページ-22.pdf (Page 1),PDF文書
座標形容詞の前の冠詞は修飾する名詞の数と意味に応じて繰り返すか省略すること,['文法'],19900017394-ページ-22.pdf (Page 1),PDF文書
座標形容詞が異なる対象を指す場合、単数名詞では冠詞を繰り返すこと,['文法'],19900017394-ページ-22.pdf (Page 1),PDF文書
座標形容詞が異なる対象を指す場合、複数名詞では冠詞を繰り返さないこと,['文法'],19900017394-ページ-22.pdf (Page 1),PDF文書
座標形容詞が同一対象を指す場合、冠詞を繰り返さないこと,['文法'],19900017394-ページ-22.pdf (Page 1),PDF文書
図表のキャプションや見出し、タイトル、記号リストでは冠詞の省略（省略形）を許容することがある,"['文法', '形式']",19900017394-ページ-22.pdf (Page 1),PDF文書
図表のキャプションや見出し、タイトル、記号リストで冠詞を省略する場合、著者または編集者の判断で冠詞を復元してもよいこと,"['文法', '形式']",19900017394-ページ-22.pdf (Page 1),PDF文書
長い引用文は本文から分けて小さいフォントサイズで表示し、引用符で囲まないこと,['段落構成'],19900017394-ページ-85.pdf (Page 1),PDF文書
引用文中の引用符は、本文中の引用符と区別して二重引用符と単一引用符を使い分けること,['段落構成'],19900017394-ページ-85.pdf (Page 1),PDF文書
意味を明確にするために区別が必要な単語やフレーズは引用符で囲むことができること,['段落構成'],19900017394-ページ-85.pdf (Page 1),PDF文書
単語を単語として示す場合は通常イタリック体を用いること,['段落構成'],19900017394-ページ-85.pdf (Page 1),PDF文書
"entitled, the term, marked, designated, classified, named, enclosed, cited as, referred to as, signed の後に続く語句は引用符で囲むこと",['段落構成'],19900017394-ページ-85.pdf (Page 1),PDF文書
"known as, called, so-called の後に続く語句は、スラングでない限り引用符で囲まないこと",['段落構成'],19900017394-ページ-85.pdf (Page 1),PDF文書
イタリック体の語句（例：タイトルなど）はさらに引用符で囲まないこと,['段落構成'],19900017394-ページ-85.pdf (Page 1),PDF文書
スラングや専門用語は、読者にとって馴染みがない場合を除き、通常は引用符で囲まないこと,['段落構成'],19900017394-ページ-85.pdf (Page 1),PDF文書
専門用語は初出時のみ引用符で囲むことがあること,['段落構成'],19900017394-ページ-85.pdf (Page 1),PDF文書
特定の航空機、宇宙船、船舶、列車の名前はイタリック体で表記すること,['形式'],19900017394-ページ-79.pdf (Page 1),PDF文書
航空機や宇宙船のクラス名や略称（例：S.S.、H.M.S.）はイタリック体にしないこと,['形式'],19900017394-ページ-79.pdf (Page 1),PDF文書
周囲の本文がローマン体でない場合、記号の書体はイタリック体のままにすること,['形式'],19900017394-ページ-79.pdf (Page 1),PDF文書
ローマン体の本文中で通常イタリック体にする項目は、イタリック体の本文中ではローマン体にすること,['形式'],19900017394-ページ-79.pdf (Page 1),PDF文書
ローマン体の本文中で通常イタリック体にする項目は、イタリック体の本文中では大文字小文字やボールド体で表記してもよいこと,['形式'],19900017394-ページ-79.pdf (Page 1),PDF文書
句読点は直前の文字と同じ書体で設定すること（ただし、括弧や角括弧は例外）,['形式'],19900017394-ページ-79.pdf (Page 1),PDF文書
引用符、疑問符、感嘆符、括弧は文脈に応じた書体で設定することが望ましいこと,['形式'],19900017394-ページ-79.pdf (Page 1),PDF文書
括弧は非制限的または挿入的な要素を囲むのに使用すること,['形式'],19900017394-ページ-79.pdf (Page 1),PDF文書
括弧で囲む要素は文とゆるく関連し、省略しても文の意味が損なわれない内容に限定すること,['形式'],19900017394-ページ-79.pdf (Page 1),PDF文書
文中の列挙において番号は括弧で囲むこと,['形式'],19900017394-ページ-79.pdf (Page 1),PDF文書
単位修飾語の曖昧さを避けるために必要に応じてハイフンを使用すること,"['文法', '形式']",19900017394-ページ-23.pdf (Page 1),PDF文書
単位修飾語は必ずしもハイフンでつなぐ必要はなく、意味が明確で読みやすい場合はハイフンを省略可能であること,"['文法', '形式']",19900017394-ページ-23.pdf (Page 1),PDF文書
単位修飾語の意味が不明瞭な場合は、ハイフン付きの複合語よりも前置詞句に書き換えて意味を明確にすることを推奨すること,"['文法', '形式']",19900017394-ページ-23.pdf (Page 1),PDF文書
前置詞句を多用しすぎると文章が読みにくくなるため、適切なバランスで単位修飾語の表現を選択すること,"['文法', '形式']",19900017394-ページ-23.pdf (Page 1),PDF文書
G.P.O.のルール6.16に従い、意味が明確で読みやすさが向上しない場合は一時的または造語的な複合語にハイフンを使用しないこと,"['文法', '形式']",19900017394-ページ-23.pdf (Page 1),PDF文書
公共の場所や施設の固有名詞は大文字で始めること,['形式'],19900017394-ページ-100.pdf (Page 1),PDF文書
正式に恒久的な研究施設の名称は大文字で始めること,['形式'],19900017394-ページ-100.pdf (Page 1),PDF文書
一時的な装置や施設の名称は大文字で始めないこと,['形式'],19900017394-ページ-100.pdf (Page 1),PDF文書
月と曜日の名称は大文字で始めること,['形式'],19900017394-ページ-100.pdf (Page 1),PDF文書
季節の名称は小文字で始めること,['形式'],19900017394-ページ-100.pdf (Page 1),PDF文書
歴史的な出来事の名称は大文字で始めること,['形式'],19900017394-ページ-100.pdf (Page 1),PDF文書
