knowledge,issue_category,reference_url,knowledge_type
疑問符は引用符や括弧の直前に置くのは、疑問符が引用内または括弧内の一部である場合のみとすること,['形式'],19900017394-ページ-84.pdf (Page 1),PDF文書
疑問符で文が終わる場合、句点は省略すること,['形式'],19900017394-ページ-84.pdf (Page 1),PDF文書
疑問符の後にコンマを置かず、必要な場合はセミコロンを用いること,['形式'],19900017394-ページ-84.pdf (Page 1),PDF文書
引用符は他の文献からの引用、直接話法、または周囲の文章と区別する必要がある語句を囲むために使用し、必ず対で用いること,['形式'],19900017394-ページ-84.pdf (Page 1),PDF文書
"通常は二重引用符（"" ""）を使用し、二重引用符内でさらに引用がある場合は単一引用符（' '）を使用すること",['形式'],19900017394-ページ-84.pdf (Page 1),PDF文書
引用文は原文をそのまま引用符で囲むこと,['形式'],19900017394-ページ-84.pdf (Page 1),PDF文書
引用文の出典は文脈または参考文献の引用で明確に示すこと,['形式'],19900017394-ページ-84.pdf (Page 1),PDF文書
表の副題、ヘッドノート、ボックスヘッド、単語・フレーズ・文からなる表の項目は文頭式の大文字を使用,['形式'],19900017394-ページ-93.pdf (Page 1),PDF文書
脚注（本文または表の脚注）は文頭式の大文字を使用,['形式'],19900017394-ページ-93.pdf (Page 1),PDF文書
図のキャプションは文頭式の大文字を使用し、図の下に配置,['形式'],19900017394-ページ-93.pdf (Page 1),PDF文書
図のラベルは頭文字のみ大文字（イニシャルキャップ）を推奨し、全大文字や大文字・小文字混在は避ける,['形式'],19900017394-ページ-93.pdf (Page 1),PDF文書
記号式表現中の単語やフレーズは文頭式の大文字を使用,['形式'],19900017394-ページ-93.pdf (Page 1),PDF文書
見出しの大文字化は見出し式を用い、主要な単語はすべて大文字化（Caps & lc）する,['形式'],19900017394-ページ-93.pdf (Page 1),PDF文書
"見出し式の大文字化では冠詞（a, an, the）、前置詞（at, by, for, of, in, up, on, to）、接続詞（and, as, but, if, or, nor）は大文字化しない",['形式'],19900017394-ページ-93.pdf (Page 1),PDF文書
見出し式の大文字化では4文字以上の単語を主要語とみなし大文字化する,['形式'],19900017394-ページ-93.pdf (Page 1),PDF文書
見出し式の大文字化では見出しの最初と最後の単語は必ず大文字化する,['形式'],19900017394-ページ-93.pdf (Page 1),PDF文書
見出し式の大文字化では2語からなるハイフン結合語の両方の要素を大文字化するが、複合数詞の第2要素は大文字化しない,['形式'],19900017394-ページ-93.pdf (Page 1),PDF文書
制限用法の関係代名詞にはthatを使用することが推奨される,['文法'],19900017394-ページ-15.pdf (Page 1),PDF文書
前置詞の後にはwhichを使用すること,['文法'],19900017394-ページ-15.pdf (Page 1),PDF文書
指示詞thatの後にはwhichを使用すること,['文法'],19900017394-ページ-15.pdf (Page 1),PDF文書
関係代名詞と先行詞の間に句や節が入る場合はwhichを使用することが自然である,['文法'],19900017394-ページ-15.pdf (Page 1),PDF文書
制限用法の関係代名詞thatの省略は推奨されない,['文法'],19900017394-ページ-15.pdf (Page 1),PDF文書
関係代名詞whoは格変化を持ち、主格はwho、目的格はwhom、所有格はwhoseであること,['文法'],19900017394-ページ-15.pdf (Page 1),PDF文書
関係節が倒置されている場合、目的格の関係代名詞whomを使用すべきか判断が難しい場合は、関係節を独立節に書き換えて代名詞の格を確認すること,['文法'],19900017394-ページ-15.pdf (Page 1),PDF文書
主語は文中の主要な動作を行うか受ける語に設定すること,['文法'],19900017394-ページ-37.pdf (Page 1),PDF文書
受動態よりも能動態を用いて主語に近い動詞を配置し読みやすさを向上させること,['文法'],19900017394-ページ-37.pdf (Page 1),PDF文書
文の主語は前文の内容と関連付けて文間のつながりを良くすること,['段落構成'],19900017394-ページ-37.pdf (Page 1),PDF文書
間接構文（expletive thereやitを用いる構文）は冗長であるため可能な限り避けること,"['文法', '形式']",19900017394-ページ-37.pdf (Page 1),PDF文書
間接構文を直接的な主語と動詞の構文に書き換え、簡潔に表現すること,['文法'],19900017394-ページ-37.pdf (Page 1),PDF文書
比較文における指示対象の明確化のため、指示代名詞の先行詞が不明瞭な場合は文を言い換えるか比較対象を繰り返すこと,['文法'],19900017394-ページ-50.pdf (Page 1),PDF文書
比較文では、thanの後に比較対象を明確に示すことが必要であり、省略は避けること,['文法'],19900017394-ページ-50.pdf (Page 1),PDF文書
比較の基準が明確でない場合、比較文は意味をなさないため、基準を明示すること,['文法'],19900017394-ページ-50.pdf (Page 1),PDF文書
動詞compareは意味に応じてtoまたはwithを用いること。対象を並べて違い・類似点を検討する場合はwithを使用すること,['文法'],19900017394-ページ-50.pdf (Page 1),PDF文書
比較文でparticipial phraseのcompared withは誤用されやすいため、より適切な構文を用いることが望ましい,['文法'],19900017394-ページ-50.pdf (Page 1),PDF文書
修飾語が主語と動詞の間に多すぎると文の連続性が損なわれること,['文法'],19900017394-ページ-41.pdf (Page 1),PDF文書
副詞的修飾語は文中で移動可能であることが多いこと,['文法'],19900017394-ページ-41.pdf (Page 1),PDF文書
形容詞句や形容詞節は修飾する名詞の近くに置く必要があること,['文法'],19900017394-ページ-41.pdf (Page 1),PDF文書
長い形容詞句や形容詞節が主語と動詞の間に入る場合、修正方法として修飾語の短縮があること,['文法'],19900017394-ページ-41.pdf (Page 1),PDF文書
長い形容詞句や形容詞節が主語と動詞の間に入る場合、主語と動詞の倒置による修正が可能であること,['文法'],19900017394-ページ-41.pdf (Page 1),PDF文書
主語と動詞の倒置は文の強調を変え、しばしば不自然に聞こえることがあること,['文法'],19900017394-ページ-41.pdf (Page 1),PDF文書
動詞句が短く修飾が明確な場合、主語と形容詞の間に動詞を置く修正が許容されること,['文法'],19900017394-ページ-41.pdf (Page 1),PDF文書
関係節とその先行詞の間に動詞を置くことは文法的に誤りだが、修飾が明確なら許容される場合があること,['文法'],19900017394-ページ-41.pdf (Page 1),PDF文書
物理概念を表す数学記号および文字記号はイタリック体で表記すること,['形式'],19900017394-ページ-78.pdf (Page 1),PDF文書
化学記号、コンピュータ記号、略語はイタリック体にしないこと,['形式'],19900017394-ページ-78.pdf (Page 1),PDF文書
ベクトル、テンソル、行列を表す記号は太字ローマン体で表記可能であること,['形式'],19900017394-ページ-78.pdf (Page 1),PDF文書
タイプライター体のテキストでは、イタリック体に通常なる記号の周囲にダブルスペースを入れて区別することを推奨する,['形式'],19900017394-ページ-78.pdf (Page 1),PDF文書
書籍、報告書、編纂物、新聞、定期刊行物のタイトルおよび副題はイタリック体で表記すること,['形式'],19900017394-ページ-78.pdf (Page 1),PDF文書
記事、会議資料、論文、編纂物中の論文、特許のタイトルはイタリック体にしないこと,['形式'],19900017394-ページ-78.pdf (Page 1),PDF文書
読者に馴染みのない外国語はイタリック体で表記すること,['形式'],19900017394-ページ-78.pdf (Page 1),PDF文書
外国の固有名詞、外国通貨、英語に取り入れられた外国語のフレーズはイタリック体にしないこと,['形式'],19900017394-ページ-78.pdf (Page 1),PDF文書
生物学的な属名、種名、品種名はイタリック体で表記し、高次分類はイタリック体にしないこと,['形式'],19900017394-ページ-78.pdf (Page 1),PDF文書
要約は200語以内に制限,['段落構成'],19900017394-ページ-6.pdf (Page 1),PDF文書
図のキャプションは図の下に配置,"['段落構成', '形式']",19900017394-ページ-6.pdf (Page 1),PDF文書
引用は著者名と年を記載,['形式'],19900017394-ページ-6.pdf (Page 1),PDF文書
ページ番号は印刷しない,['形式'],19900017394-ページ-6.pdf (Page 1),PDF文書
図の環境でのセンタリング推奨,['形式'],19900017394-ページ-6.pdf (Page 1),PDF文書
フォントサイズは10ポイントに設定,['形式'],19900017394-ページ-6.pdf (Page 1),PDF文書
タイトルは米国の大文字ルールに従うこと,['形式'],19900017394-ページ-6.pdf (Page 1),PDF文書
タイプ3フォントの使用禁止,['形式'],19900017394-ページ-6.pdf (Page 1),PDF文書
前置詞のイディオムは文法規則ではなく慣用的用法に従うこと,['文法'],19900017394-ページ-27.pdf (Page 1),PDF文書
前置詞のイディオムの正しい用法は辞書や用法辞典を参照すること,['文法'],19900017394-ページ-27.pdf (Page 1),PDF文書
文末の前置詞は文法的に許容されるが、強調のために避けることが推奨される,['文法'],19900017394-ページ-27.pdf (Page 1),PDF文書
文末の前置詞を避けるために語順を不自然に変えることは避けること,['文法'],19900017394-ページ-27.pdf (Page 1),PDF文書
並列句では明確さや平行性のために必要な場合にのみ前置詞を繰り返すこと,['文法'],19900017394-ページ-27.pdf (Page 1),PDF文書
強調のために前置詞や冠詞を繰り返すことは許容されること,['文法'],19900017394-ページ-27.pdf (Page 1),PDF文書
時間帯の名称は小文字で記述すること（例：eastern standard time）,['形式'],19900017394-ページ-101.pdf (Page 1),PDF文書
"特定の時間帯名称は大文字で記述すること（例：Greenwich mean time, Pacific standard time）",['形式'],19900017394-ページ-101.pdf (Page 1),PDF文書
"地質学における地質時代の名称は大文字で記述すること（例：Upper Cambrian Period, Bronze Age）",['形式'],19900017394-ページ-101.pdf (Page 1),PDF文書
"地質学における土壌群の名称は大文字で記述すること（例：Laterite, Tundra）",['形式'],19900017394-ページ-101.pdf (Page 1),PDF文書
"天文学における天体の名称は大文字で記述すること（例：North Star, Halley's Comet, Venus, Earth）",['形式'],19900017394-ページ-101.pdf (Page 1),PDF文書
地球の地面を指す場合の「earth」は小文字で記述すること,['形式'],19900017394-ページ-101.pdf (Page 1),PDF文書
木星の衛星を指す場合の「moons」は小文字で記述すること,['形式'],19900017394-ページ-101.pdf (Page 1),PDF文書
生物学的分類名の階級に応じて大文字を使用すること（例：門Phylum、綱Class、目Order、科Family、属Genusは大文字）,['形式'],19900017394-ページ-101.pdf (Page 1),PDF文書
生物学的種名（species）は小文字で記述すること（例：canadensis）,['形式'],19900017394-ページ-101.pdf (Page 1),PDF文書
"コロンはthat is, for example, such asの後に使用しないこと",['文法'],19900017394-ページ-58.pdf (Page 1),PDF文書
コロンはリストの導入に使用し、リストの要素を強調することができること,"['文法', '段落構成']",19900017394-ページ-58.pdf (Page 1),PDF文書
コロンを使う場合、リストの導入句が名詞の同格であるときに使用すること,['文法'],19900017394-ページ-58.pdf (Page 1),PDF文書
リストの導入句にas followsまたはthe followingが含まれる場合、コロンを使用してリストを導入すること,['文法'],19900017394-ページ-58.pdf (Page 1),PDF文書
コロンは文の導入文を補強・拡張するリストの導入に使用すること,"['文法', '段落構成']",19900017394-ページ-58.pdf (Page 1),PDF文書
番号付きリストの番号は句読点の役割を持たず、リストの区切りに影響しないこと,['文法'],19900017394-ページ-58.pdf (Page 1),PDF文書
コロンは強い区切りを示すため、文法的に不適切な場所での使用を避けること,['文法'],19900017394-ページ-58.pdf (Page 1),PDF文書
コロンの誤用は強調の意図がある場合が多いため、強調を保つ正しい修正（例：箇条書き）を検討すること,"['文法', '段落構成']",19900017394-ページ-58.pdf (Page 1),PDF文書
相対代名詞の先行詞は人を指す場合はwhoまたはwhomを使用すること,['文法'],19900017394-ページ-14.pdf (Page 1),PDF文書
相対代名詞の先行詞が物の場合はwhichを使用すること,['文法'],19900017394-ページ-14.pdf (Page 1),PDF文書
相対代名詞thatは物を指し、稀に人を指す場合があること,['文法'],19900017394-ページ-14.pdf (Page 1),PDF文書
所有格の相対代名詞whoseは人または物の両方に使用可能であること,['文法'],19900017394-ページ-14.pdf (Page 1),PDF文書
物に対してwhoseを使うことがawkwardな場合はwhichの代わりにwhoseを使うことが推奨されること,['文法'],19900017394-ページ-14.pdf (Page 1),PDF文書
非制限用法の関係節にはwhichを使用し、節をカンマで囲むことが必須であること,"['文法', '段落構成']",19900017394-ページ-14.pdf (Page 1),PDF文書
制限用法の関係節にはwhichを使うことも可能だが、適切な句読点を用い制限用法の節はカンマで囲まないことが重要であること,"['文法', '段落構成']",19900017394-ページ-14.pdf (Page 1),PDF文書
文章中の代名詞の使用は曖昧さを避けるために具体的な名詞に置き換えることが望ましいこと,"['文法', '単語']",19900017394-ページ-14.pdf (Page 1),PDF文書
頭字語は常にすべて大文字で表記すること,['形式'],19900017394-ページ-95.pdf (Page 1),PDF文書
頭字語の定義文中では、頭字語の文字は固有名詞でない限り大文字にしないこと,['形式'],19900017394-ページ-95.pdf (Page 1),PDF文書
頭字語の定義文中で固有名詞を表す場合は大文字を使用すること,['形式'],19900017394-ページ-95.pdf (Page 1),PDF文書
頭字語の構成文字をイタリック体で示す必要は通常ないこと,['形式'],19900017394-ページ-95.pdf (Page 1),PDF文書
略語は一般に略された語の大文字・小文字の形に従うこと,['形式'],19900017394-ページ-95.pdf (Page 1),PDF文書
タイトルや見出しで主要語が大文字の場合でも、通常の小文字の略語は小文字のままにすること,['形式'],19900017394-ページ-95.pdf (Page 1),PDF文書
単位の略語はタイトルや見出しでも小文字で表記すること,['形式'],19900017394-ページ-95.pdf (Page 1),PDF文書
固有名詞および固有形容詞は必ず大文字で表記すること,['形式'],19900017394-ページ-95.pdf (Page 1),PDF文書
固有名詞の定義は「特定の人名、地名、組織名、政治区分、暦の区分、歴史的出来事や祝日名」とすること,['形式'],19900017394-ページ-95.pdf (Page 1),PDF文書
固有名詞かどうか判断が難しい場合は辞書やスタイルマニュアルを参照すること,['形式'],19900017394-ページ-95.pdf (Page 1),PDF文書
略語の定義時には大文字を適切に使用すること,['形式'],19900017394-ページ-110.pdf (Page 1),PDF文書
略語は定義時に大文字で表記すること,['形式'],19900017394-ページ-110.pdf (Page 1),PDF文書
アクティブボイスとパッシブボイスの使い分けに注意すること,['文法'],19900017394-ページ-110.pdf (Page 1),PDF文書
住所表記にはコンマを適切に使用すること,['形式'],19900017394-ページ-110.pdf (Page 1),PDF文書
形容詞の位置と用法に注意すること,['文法'],19900017394-ページ-110.pdf (Page 1),PDF文書
冠詞の使用に注意し、主語と動詞の間に誤って挿入しないこと,['文法'],19900017394-ページ-110.pdf (Page 1),PDF文書
比較級と最上級の正しい使い方を守ること,['文法'],19900017394-ページ-110.pdf (Page 1),PDF文書
副詞の位置に注意し、誤った位置に置かないこと,['文法'],19900017394-ページ-110.pdf (Page 1),PDF文書
and/orの使用時には動詞の単複数形に注意すること,['文法'],19900017394-ページ-110.pdf (Page 1),PDF文書
先行詞の明確化に注意し、代名詞の曖昧さを避けること,['文法'],19900017394-ページ-110.pdf (Page 1),PDF文書
同格語句は制限的でない場合、カンマで囲むこと,['形式'],19900017394-ページ-67.pdf (Page 1),PDF文書
制限的同格語句はカンマで囲まないこと,['形式'],19900017394-ページ-67.pdf (Page 1),PDF文書
同格語句にカンマが含まれる場合、明確化のためダッシュ（emダッシュ）で囲むことを推奨,['形式'],19900017394-ページ-67.pdf (Page 1),PDF文書
非制限的同格語句の前に'or'を用いる場合は必ずカンマで囲むこと,['形式'],19900017394-ページ-67.pdf (Page 1),PDF文書
記号的同格語句は制限的・非制限的にかかわらず通常カンマを省略すること,['形式'],19900017394-ページ-67.pdf (Page 1),PDF文書
非制限的記号的同格語句は著者または編集者の判断でカンマで囲むことができる,['形式'],19900017394-ページ-67.pdf (Page 1),PDF文書
非制限的な挿入句（括弧句、修辞的副詞、対照的句、導入語など）はカンマで囲むことができる,['形式'],19900017394-ページ-67.pdf (Page 1),PDF文書
修辞的副詞の位置と句読点は文の強調に影響を与えるため注意すること,['形式'],19900017394-ページ-67.pdf (Page 1),PDF文書
一般的な知識や信念を示す間接構文の使用は曖昧さを招くため、可能な限り個人代名詞を用いること,['文法'],19900017394-ページ-38.pdf (Page 1),PDF文書
"先行詞が明確でない場合、広範な指示代名詞（this, these, that, those）を名詞として使用することは避けること",['文法'],19900017394-ページ-38.pdf (Page 1),PDF文書
文の主語は明確かつ具体的であり、前の内容と関連付けられていることが望ましいこと,['文法'],19900017394-ページ-38.pdf (Page 1),PDF文書
動詞は文章の行動を表現する唯一の語であり、活力のある動詞を用いることで文章を簡潔かつ読みやすくすること,['文法'],19900017394-ページ-38.pdf (Page 1),PDF文書
動詞の行動性を弱める表現（受動態、動詞派生名詞など）は文章の力を弱めるため、可能な限り能動態の動詞を使用すること,['文法'],19900017394-ページ-38.pdf (Page 1),PDF文書
動詞が主語になることで弱い動詞に置き換わる場合は、動詞を主語にしない表現に改めること,['文法'],19900017394-ページ-38.pdf (Page 1),PDF文書
導入句の直後に動詞が続く場合、導入句の後にコンマを置かないこと,['文法'],19900017394-ページ-63.pdf (Page 1),PDF文書
導入句や節の後のコンマは、限定的な導入要素の前には置かないこと,['文法'],19900017394-ページ-63.pdf (Page 1),PDF文書
非限定的な導入要素の場合は、前後にコンマを置くことが適切であること,['文法'],19900017394-ページ-63.pdf (Page 1),PDF文書
連続する形容詞のうち、andで結べる場合はコンマで区切ること（座標形容詞の区別）,"['文法', '単語']",19900017394-ページ-63.pdf (Page 1),PDF文書
技術文書は簡潔で冗長性や不必要な詳細を排除すること,['段落構成'],19900017394-ページ-44.pdf (Page 1),PDF文書
簡潔さを追求する際に単語数を最小化しすぎて強調や意味を損なわないこと,['段落構成'],19900017394-ページ-44.pdf (Page 1),PDF文書
編集者は不要または冗長な単語を削除することを推奨,['段落構成'],19900017394-ページ-44.pdf (Page 1),PDF文書
冗長表現の例として同義反復（タウトロジー）は避けること,['文法'],19900017394-ページ-44.pdf (Page 1),PDF文書
「ac current 20 sec in duration」は「current」に簡略化すること,"['文法', '単語']",19900017394-ページ-44.pdf (Page 1),PDF文書
「close proximity」は「close」に簡略化すること,"['文法', '単語']",19900017394-ページ-44.pdf (Page 1),PDF文書
「in the range of 1 to 10」は「from 1 to 10」に置き換えること,"['文法', '単語']",19900017394-ページ-44.pdf (Page 1),PDF文書
"動詞の冗長表現を避け、より簡潔な動詞を使用すること（例：""are found to be in agreement""は""agree""に）","['文法', '単語']",19900017394-ページ-44.pdf (Page 1),PDF文書
"動詞の冗長表現例：""analyses were made""は""analyze""に置き換えること","['文法', '単語']",19900017394-ページ-44.pdf (Page 1),PDF文書
"動詞の冗長表現例：""make adjustments to""は""adjust""に置き換えること","['文法', '単語']",19900017394-ページ-44.pdf (Page 1),PDF文書
タイトルは米国式の大文字ルールに従うこと,['形式'],19900017394-ページ-5.pdf (Page 1),PDF文書
要約は200語以内に制限すること,['形式'],19900017394-ページ-5.pdf (Page 1),PDF文書
図のキャプションは図の下に配置すること,['形式'],19900017394-ページ-5.pdf (Page 1),PDF文書
図は図の環境内で中央揃えにすることが推奨される,['形式'],19900017394-ページ-5.pdf (Page 1),PDF文書
引用は著者名と発行年を記載すること,['形式'],19900017394-ページ-5.pdf (Page 1),PDF文書
ページ番号は印刷しないこと,['形式'],19900017394-ページ-5.pdf (Page 1),PDF文書
フォントサイズは10ポイントに設定すること,['形式'],19900017394-ページ-5.pdf (Page 1),PDF文書
タイプ3フォントの使用は禁止されている,['形式'],19900017394-ページ-5.pdf (Page 1),PDF文書
強調のために文全体や長い文章をイタリック体にしないこと,['形式'],19900017394-ページ-77.pdf (Page 1),PDF文書
イタリック体の多用は効果を減少させるため避けること,['形式'],19900017394-ページ-77.pdf (Page 1),PDF文書
強調が文脈から明らかな場合はイタリック体を使わないこと,['形式'],19900017394-ページ-77.pdf (Page 1),PDF文書
強調が必要な場合は文を再構成してより自然に表現することを検討すること,['形式'],19900017394-ページ-77.pdf (Page 1),PDF文書
議論の重要用語や定義付きの専門用語は初出時にイタリック体にすること,['形式'],19900017394-ページ-77.pdf (Page 1),PDF文書
新造語や非標準的な専門用語はイタリック体ではなく引用符で囲むことを推奨すること,['形式'],19900017394-ページ-77.pdf (Page 1),PDF文書
単語をそのものとして示す場合はイタリック体にすること（例：単語自体を指す場合）,['形式'],19900017394-ページ-77.pdf (Page 1),PDF文書
文字を文字として示す場合はイタリック体にすること（例：文字の名称や記号として）,['形式'],19900017394-ページ-77.pdf (Page 1),PDF文書
形状を示す文字（例：V字尾、L字型）、文字の指定（例：ケースA、付録C）、図表の細分化（例：図1(a)、式(2c)）はイタリック体にしないこと,['形式'],19900017394-ページ-77.pdf (Page 1),PDF文書
"イタリック体の単語や文字の複数形はローマン体のsを付けること（例：and's, if's, i's）",['形式'],19900017394-ページ-77.pdf (Page 1),PDF文書
